{
  "schema_version": 1,
  "provider_code": "YAHOO",
  "source_code": "yahoo_daily",
  "parser_version": "1.1.0",
  "format_reference": "docs/stonks/ohlcv-yahoo-source-contract.md#response-and-daily-bar-contract",
  "provenance": "constructed_from_documented_format",
  "payload_file": "ust10y_timezone_mismatch.json",
  "payload_size_bytes": 268,
  "payload_sha256": "ca97bfccf3719249465d60e399cd28a514ef75003a055e5ccdaff354a775f24e",
  "sanitization": [
    "Retained the affected public Yahoo symbol and observed response timezone with fixed representative OHLC values.",
    "Excluded request URLs, headers, cookies, credentials, and unrelated response metadata."
  ],
  "cases": [
    "UST10Y response timezone differs from its eligibility-policy timezone",
    "provider dates remain correct across the March daylight-saving boundary"
  ]
}
