{
  "schema_version": 1,
  "provider_code": "YAHOO",
  "source_code": "yahoo_daily",
  "parser_version": "1.1.0",
  "format_reference": "docs/stonks/ohlcv-yahoo-source-contract.md#response-and-daily-bar-contract",
  "provenance": "constructed_from_documented_format",
  "payload_file": "vxn_timezone_mismatch.json",
  "payload_size_bytes": 269,
  "payload_sha256": "3b4f034aeef961f77fd40df8717e966e4ce0714adbb15a6c2b00b7d89f367dad",
  "sanitization": [
    "Retained the affected public Yahoo symbol and observed response timezone with fixed representative OHLC values.",
    "Excluded request URLs, headers, cookies, credentials, and unrelated response metadata."
  ],
  "cases": [
    "VXN response timezone differs from its eligibility-policy timezone",
    "provider dates remain correct across the March daylight-saving boundary"
  ]
}
