{
  "schema_version": 1,
  "provider_code": "YAHOO",
  "source_code": "yahoo_daily",
  "parser_version": "1.1.0",
  "format_reference": "docs/stonks/ohlcv-yahoo-source-contract.md#response-and-daily-bar-contract",
  "provenance": "constructed_from_documented_format",
  "payload_file": "skew_timezone_mismatch.json",
  "payload_size_bytes": 270,
  "payload_sha256": "1fd72dca5e6a728e7004d30e5c9727c46e7ef90f095d3e1414a5215b489778fd",
  "sanitization": [
    "Retained the affected public Yahoo symbol and observed response timezone with fixed representative OHLC values.",
    "Excluded request URLs, headers, cookies, credentials, and unrelated response metadata."
  ],
  "cases": [
    "SKEW response timezone differs from its eligibility-policy timezone",
    "provider dates remain correct across the March daylight-saving boundary"
  ]
}
